{
  "$schema": "https://github.com/MartiXDev/Platform/schemas/beta-integration.schema.json",
  "schemaVersion": "1.0.0",
  "kind": "beta-integration-evidence",
  "solution": "BetaIntegrationGeneratedSolution",
  "targetPlatformVersion": "1.0.0-beta.1",
  "maturity": "beta",
  "matrix": {
    "strategy": "risk-based-covering-array",
    "axes": {
      "presets": [
        "api",
        "modular-monolith",
        "full-stack"
      ],
      "endpointModels": [
        "minimal-api",
        "fastendpoints"
      ],
      "relationalProviders": [
        "postgresql",
        "sqlserver"
      ],
      "authenticationProfiles": [
        "none",
        "identity:interactive",
        "oidc:interactive",
        "oidc:api",
        "entra:interactive",
        "entra:api-delegated",
        "entra:api-application"
      ],
      "uiProviders": [
        "blazor-webapp",
        "react",
        "vue"
      ],
      "infrastructureProviders": [
        {
          "capability": "relational-persistence",
          "id": "postgresql"
        },
        {
          "capability": "relational-persistence",
          "id": "sqlserver"
        },
        {
          "capability": "distributed-cache",
          "id": "valkey"
        },
        {
          "capability": "durable-jobs",
          "id": "quartz"
        },
        {
          "capability": "broker-transport",
          "id": "rabbitmq"
        },
        {
          "capability": "object-storage",
          "id": "azure-blob"
        },
        {
          "capability": "notification-delivery",
          "id": "mailkit-smtp"
        },
        {
          "capability": "secrets",
          "id": "azure-key-vault"
        },
        {
          "capability": "feature-management",
          "id": "microsoft-feature-management"
        },
        {
          "capability": "observability-export",
          "id": "otlp"
        }
      ],
      "deploymentProfiles": [
        "process",
        "oci",
        "direct",
        "aspire",
        "compose"
      ]
    },
    "coverage": {
      "presets": [
        {
          "id": "api",
          "status": "passed",
          "evidence": [
            "tests/api-preset.test.mjs",
            "tests/api-release.test.mjs",
            "tests/fixtures/RepositoryBootstrapGeneratedSolution/README.md"
          ]
        },
        {
          "id": "modular-monolith",
          "status": "passed",
          "evidence": [
            "tests/modular-monolith.test.mjs",
            "tests/modular-monolith-alpha.test.mjs",
            "tests/fixtures/ModularMonolithGeneratedSolution/README.md"
          ]
        },
        {
          "id": "full-stack",
          "status": "passed",
          "evidence": [
            "tests/full-stack-preset.test.mjs",
            "tests/bootstrap.test.mjs",
            "tests/fixtures/FullStackGeneratedSolution/README.md"
          ]
        }
      ],
      "endpointModels": [
        {
          "id": "minimal-api",
          "status": "passed",
          "evidence": [
            "tests/api-preset.test.mjs",
            "tests/api-release.test.mjs"
          ]
        },
        {
          "id": "fastendpoints",
          "status": "passed",
          "evidence": [
            "tests/fastendpoints.test.mjs",
            "tests/Compatibility/FastEndpointsAdapterGeneratedSolution/FastEndpointsAdapterContractTests.cs",
            "eng/verify-fastendpoints.mjs"
          ]
        }
      ],
      "relationalProviders": [
        {
          "id": "postgresql",
          "status": "passed",
          "evidence": [
            "tests/modular-monolith-alpha.test.mjs",
            "eng/verify-modular-monolith-alpha.mjs"
          ]
        },
        {
          "id": "sqlserver",
          "status": "passed",
          "evidence": [
            "tests/modular-monolith-alpha.test.mjs",
            "eng/verify-modular-monolith-alpha.mjs"
          ]
        }
      ],
      "authenticationProfiles": [
        {
          "id": "none",
          "status": "passed",
          "evidence": [
            "tests/api-preset.test.mjs",
            "tests/modular-monolith.test.mjs",
            "eng/authentication-profile.mjs"
          ]
        },
        {
          "id": "identity:interactive",
          "status": "passed",
          "evidence": [
            "tests/modular-monolith.test.mjs",
            "eng/authentication-profile.mjs"
          ]
        },
        {
          "id": "oidc:interactive",
          "status": "passed",
          "evidence": [
            "tests/api-preset.test.mjs",
            "tests/modular-monolith.test.mjs",
            "eng/authentication-profile.mjs"
          ]
        },
        {
          "id": "oidc:api",
          "status": "passed",
          "evidence": [
            "tests/api-preset.test.mjs",
            "eng/authentication-profile.mjs"
          ]
        },
        {
          "id": "entra:interactive",
          "status": "passed",
          "evidence": [
            "tests/api-preset.test.mjs",
            "tests/modular-monolith.test.mjs",
            "eng/authentication-profile.mjs"
          ]
        },
        {
          "id": "entra:api-delegated",
          "status": "passed",
          "evidence": [
            "tests/api-preset.test.mjs",
            "eng/authentication-profile.mjs"
          ]
        },
        {
          "id": "entra:api-application",
          "status": "passed",
          "evidence": [
            "tests/api-preset.test.mjs",
            "eng/authentication-profile.mjs"
          ]
        }
      ],
      "uiProviders": [
        {
          "id": "blazor-webapp",
          "status": "passed",
          "evidence": [
            "tests/full-stack-preset.test.mjs",
            "tests/fixtures/FullStackGeneratedSolution/README.md",
            "eng/full-stack-ui-contract.mjs"
          ]
        },
        {
          "id": "react",
          "status": "passed",
          "evidence": [
            "tests/full-stack-preset.test.mjs",
            "eng/full-stack-ui-contract.mjs"
          ]
        },
        {
          "id": "vue",
          "status": "passed",
          "evidence": [
            "tests/full-stack-preset.test.mjs",
            "eng/full-stack-ui-contract.mjs"
          ]
        }
      ],
      "infrastructureProviders": [
        {
          "capability": "relational-persistence",
          "id": "postgresql",
          "preset": "modular-monolith",
          "status": "passed",
          "evidence": [
            "tests/modular-monolith-alpha.test.mjs",
            "eng/provider-admission.mjs"
          ]
        },
        {
          "capability": "relational-persistence",
          "id": "sqlserver",
          "preset": "modular-monolith",
          "status": "passed",
          "evidence": [
            "tests/modular-monolith-alpha.test.mjs",
            "eng/provider-admission.mjs"
          ]
        },
        {
          "capability": "distributed-cache",
          "id": "valkey",
          "preset": "api",
          "status": "passed",
          "evidence": [
            "tests/valkey-distributed-cache.test.mjs",
            "tests/fixtures/ValkeyDistributedCacheGeneratedSolution/valkey-conformance.json"
          ]
        },
        {
          "capability": "durable-jobs",
          "id": "quartz",
          "preset": "modular-monolith",
          "status": "passed",
          "evidence": [
            "tests/modular-monolith.test.mjs",
            "tests/fixtures/QuartzDurableJobsGeneratedSolution/README.md"
          ]
        },
        {
          "capability": "broker-transport",
          "id": "rabbitmq",
          "preset": "modular-monolith",
          "status": "passed",
          "evidence": [
            "tests/rabbitmq.test.mjs",
            "tests/provider-admission.test.mjs"
          ]
        },
        {
          "capability": "object-storage",
          "id": "azure-blob",
          "preset": "api",
          "status": "passed",
          "evidence": [
            "tests/object-storage.test.mjs",
            "tests/fixtures/ProviderAdmissionGeneratedSolution/provider-admission.json"
          ]
        },
        {
          "capability": "notification-delivery",
          "id": "mailkit-smtp",
          "preset": "api",
          "status": "passed",
          "evidence": [
            "tests/mailkit-smtp.test.mjs",
            "tests/fixtures/MailKitSmtpGeneratedSolution/mailkit-smtp.json"
          ]
        },
        {
          "capability": "secrets",
          "id": "azure-key-vault",
          "preset": "api",
          "status": "passed",
          "evidence": [
            "tests/azure-key-vault.test.mjs",
            "eng/azure-key-vault.mjs"
          ]
        },
        {
          "capability": "feature-management",
          "id": "microsoft-feature-management",
          "preset": "api",
          "status": "passed",
          "evidence": [
            "tests/feature-management.test.mjs",
            "tests/fixtures/FeatureManagementGeneratedSolution/README.md"
          ]
        },
        {
          "capability": "observability-export",
          "id": "otlp",
          "preset": "api",
          "status": "passed",
          "evidence": [
            "tests/otlp-export.test.mjs",
            "tests/fixtures/OtlpExportGeneratedSolution/otlp-export.json"
          ]
        }
      ],
      "deploymentProfiles": [
        {
          "id": "process",
          "status": "passed",
          "evidence": [
            "tests/deployment-manifest.test.mjs",
            "tests/portable-host-conformance.test.mjs",
            "tests/fixtures/DeploymentManifestGeneratedSolution/deployment-manifest.json"
          ]
        },
        {
          "id": "oci",
          "status": "passed",
          "evidence": [
            "tests/deployment-manifest.test.mjs",
            "tests/portable-host-conformance.test.mjs",